<?xml version="1.0" encoding="utf-8" ?>
<!DOCTYPE Brigades SYSTEM "Brigade.dtd">
<Brigades>
    <Brigade>
        <Pilots>
            <Pilot>Ivan Ivanovich</Pilot>
            <Pilot>Walter Ritz</Pilot>
        </Pilots>
        <Navigator>Carolus Rex</Navigator>
        <Radio-operator>Gunter Jonas</Radio-operator>
        <Stewardess>Maria Ivanovna</Stewardess>
    </Brigade>
</Brigades>